5500029740;Роль для работы в системе АС «Отчетность;В ожидании акта от подрядчика;OFERTA;13.07.2021;24.02.2022;02.12.2021;24.02.2022;83
5500029741;Тиражирование настроек системы SAP-HR;В ожидании акта от подрядчика;SAP_ESS_HR;13.07.2021;02.03.2022;17.03.2022;02.03.2022;-
5500029742;Контроль по загрузке ЭЛН с сайта ФСС.;В работе;ZUP;13.07.2021;18.03.2022;02.02.2022;08.10.2022;248
5500029743;Предосталение еженедельной выгрузки пасп;Отклонен;SAP_HR;15.07.2021;-;;;-
5500029744;Исправление RHECM_CHANGE_PROC_STATUS (C-;Закрыт;SAP_HR;15.07.2021;-;;;-
5500029745;Отчет ZHR_PT_OVERTIME по сверхурочным (C;В разработке ЧТЗ;SAP_HR;15.07.2021;30.11.2021;10.01.2022;28.05.2022;138
5500029746;СФК, подписание ПЭП документов по инвент;Закрыт;SYS_FK;19.07.2021;-;;;-
5500029747;Изменение программы ZGAC_USER_INFO;Закрыт;IB_SAP;19.07.2021;-;;;-
5500029748;Доработка аналитических таблиц АРМ КК и;Закрыт;BI_BEF;19.07.2021;-;;;-
5500029749;Разделение приложения с учетом анализа а;В работе;BI_BEF;19.07.2021;15.04.2022;26.05.2022;20.02.2023;270
5500029750;Выполнение модификации интеграционного м;Закрыт;KSHD;19.07.2021;-;;;-
5500029751;Доработки для массового обновления истор;В ожидании акта от подрядчика;OFERTA;13.07.2021;08.02.2022;02.12.2021;08.02.2022;67
5500029752;Режим обработки данных интеграции 1С:ERP;В разработке ЧТЗ;KSHD;14.07.2021;31.12.2021;15.03.2022;01.09.2022;170
5500029755;Развитие функциональности/обновление;Отклонен; ;15.07.2021;-;;;-
5500029761;САРП (Система автоматизации роботизирова;Оценка объема работ;PORTAL_ZAK;13.07.2021;28.09.2021;09.12.2021;19.02.2022;72
5500029762;Разработка пользовательского отчета по р;Закрыт;SAPFIR;14.07.2021;-;;;-
5500029763;Изменение логики публикации параметров в;Согласование ЧТЗ Инициатором;NSI_ESMUR;14.07.2021;30.12.2021;28.01.2022;16.07.2022;169
5500029764;Ограничение использования поля «Статусы;В работе;NSI_ESMUR;14.07.2021;03.06.2022;16.01.2022;06.12.2022;324
5500029765;Исправление обработки «Загрузка классифи;В работе;NSI_ESMUR;14.07.2021;15.04.2022;16.01.2022;18.10.2022;275
5500029766;Контроль актуальности ОКВЭД2, ТН ВЭД, ОК;В разработке ЧТЗ;NSI_ESMUR;14.07.2021;18.03.2022;28.01.2022;02.10.2022;247
5500029767;Контроль корректности веса нетто и брутт;В работе;NSI_ESMUR;14.07.2021;29.04.2022;16.01.2022;01.11.2022;289
5500029768;Ограничение доступности единиц измерения;Отклонен;NSI_ESMUR;14.07.2021;-;;;-
5500029769;Отбор по списку кодов в отчете «Ошибки и;В разработке ЧТЗ;NSI_ESMUR;14.07.2021;25.02.2022;28.01.2022;11.09.2022;226
5500029770;Отсчет знаков в кратком наименовании;Оценка объема работ;NSI_ESMUR;14.07.2021;22.11.2021;28.01.2022;03.06.2022;126
5500029771;Отчет по эталонной записи;Отклонен;NSI_ESMUR;14.07.2021;-;;;-
5500029772;Поиск материалов по заводу;В разработке ЧТЗ;NSI_ESMUR;14.07.2021;25.02.2022;28.01.2022;11.09.2022;226
5500029773;Чек-бокс «НТД производителя»;В разработке ЧТЗ;NSI_ESMUR;14.07.2021;25.02.2022;28.01.2022;11.09.2022;226
5500029774;Автоматическое заполнение поля «Группа М;В разработке ЧТЗ;NSI_ESMUR;14.07.2021;25.03.2022;28.01.2022;09.10.2022;254
5500029775;Делегирование функций инициатора заявки;В разработке ЧТЗ;NSI_ESMUR;14.07.2021;18.03.2022;28.01.2022;02.10.2022;247
5500029776;Обновление Плановых Дат Списания (далее;В разработке ЧТЗ;OFERTA;14.07.2021;31.12.2021;27.12.2021;15.06.2022;170
5500029777;Создание обработки данных для решения ин;Закрыт;ESON;14.07.2021;-;;;-
5500029778;Справочник «Оценочные обязательства  рез;В разработке ЧТЗ;KSU_NSI;14.07.2021;23.07.2021;22.03.2022;31.03.2022;9
5500029779;Использование СПП-элемента из Сводного к;В работе;OFERTA;14.07.2021;10.02.2022;15.12.2021;14.07.2022;211
5500029780;Доработка загрузки из АСР «Гидра» в ЕРП;В согласовании.Менеджер процесса;ERP_KFSCH;14.07.2021;19.07.2021;01.11.2021;04.11.2021;3
5500029782;Дашборд Рейтингование ДО;Согласование ЧТЗ Инициатором;RHD_BRD;15.07.2021;23.12.2021;01.02.2022;12.07.2022;161
5500029783;Дашборд ОД_ОУ;В разработке ЧТЗ;RHD_BRD;15.07.2021;23.09.2021;01.02.2022;12.04.2022;70
5500029784;Развитие функциональности/обновление реш;Закрыт;WEBSITEPOZ;15.07.2021;-;;;-
5500029785;Интеграция ИС Merak Peep с системой КЛАД;Отклонен;MERAK_PEEP;15.07.2021;-;;;-
5500029786;Изменение идентификации МТР Опережающей;В разработке ЧТЗ;OFERTA;15.07.2021;18.02.2022;28.12.2021;03.08.2022;218
5500029787;Создание раздела по рискам;В ожидании акта от подрядчика;SURNSH;15.07.2021;30.03.2022;11.10.2021;30.03.2022;170
5500029788;Развитие функциональности/обновление реш;В работе;HEALTH_ENV;15.07.2021;24.12.2021;23.11.2021;04.05.2022;162
5500029789;Изменение алгоритма формирования даты за;В ожидании акта от подрядчика;OFERTA;16.07.2021;28.12.2021;05.12.2021;28.12.2021;22
5500029790;Реализация интеграции с системой 1С СПАЭ;В работе;KSHD;20.07.2021;31.03.2022;09.03.2022;18.11.2022;254
5500029791;Развитие дашбордов МСФО;В ожидании акта от подрядчика;KHD_BEF;15.07.2021;30.11.2021;21.12.2021;30.11.2021;-
5500029792;Изменение интеграции СПО-1=>СПО-2 для КБ;Отклонен;SPO;16.07.2021;-;;;-
5500029793;Перенос данных ИС 1СПБ между ладшафтами;Отклонен;HSE;16.07.2021;-;;;-
5500029794;сделать возможным массово формировать Ак;В работе;SAPFIR;16.07.2021;28.02.2022;18.12.2021;02.08.2022;227
5500029795;Проведение ревизии справочников SAP КСУ;Отклонен;KSU_NSI;16.07.2021;-;;;-
5500029796;ТЗ грузополучателя в конкурсной процедур;В разработке ЧТЗ;OFERTA;16.07.2021;28.01.2022;29.12.2021;13.07.2022;196
5500029797;Запрет дополнительных согласующих в ШЗНО;Отклонен;KSUIT;16.07.2021;-;;;-
5500029798;АСУЗ НКЗ/ДС: Реализация дайджестов по пр;В ожидании акта от подрядчика;OFERTA;16.07.2021;16.03.2022;05.12.2021;16.03.2022;100
5500029799;АСУЗ НКЗ/ДС: Реализация итогов Инициатор;Закрыт;OFERTA;16.07.2021;-;;;-
5500029800;АСУЗ НКЗ/ДС: Расширение сводного голосов;Закрыт;OFERTA;16.07.2021;-;;;-
5500029801;АСУЗ НКЗ/ДС: Доработка проекта решения д;В ожидании акта от подрядчика;OFERTA;16.07.2021;16.03.2022;05.12.2021;16.03.2022;100
5500029802;АСУЗ НКЗ/ДС: Реализация шаблонов для Ини;В разработке ЧТЗ;OFERTA;16.07.2021;30.12.2021;29.12.2021;14.06.2022;167
5500029803;Переработка навигатора направлений;В работе;PORTALSELF;16.07.2021;30.12.2021;19.03.2022;02.09.2022;167
5500029804;6-НДФЛ: смена КПП и межрасчеты, 13 и 15%;В работе;SAP_HR;19.07.2021;31.12.2021;02.01.2022;16.06.2022;165
5500029805;Подключение ERP и PM к КШД 1С;В работе;ERP_KFSCH;19.07.2021;29.11.2021;03.11.2021;16.03.2022;133
5500029807;Изм. печатной этикетки МТР;В работе;AIS_US;20.07.2021;15.02.2022;15.12.2021;13.07.2022;210
5500029808;Пересмотр заработной платы;Закрыт;SAP_HR_TM;20.07.2021;-;;;-
5500029809;Разработка потока загрузки показателей к;Отклонен;OIS_USOI;20.07.2021;-;;;-
5500029810;Доработать интеграцию передачи данных по;В разработке ЧТЗ;ESON;21.07.2021;21.02.2022;22.03.2022;23.10.2022;215
5500029811;Создание витрины данных Maxpatrol для КЛ;Отклонен;SAP_BASIS;19.07.2021;-;;;-
5500029812;718 ФТ к реализации ЮЗЭДО в ЕРП_Хsd схем;В работе;ERP_KFSCH;19.07.2021;30.01.2022;03.11.2021;17.05.2022;195
5500029815;607 Доработка печатной формы ОС-1 (возмо;Отклонен;ERP_KFSCH;20.07.2021;-;;;-
5500029816;613 Формирование инвентаризационной опис;В работе;ERP_KFSCH;20.07.2021;04.02.2022;04.11.2021;22.05.2022;199
5500029817;639 Актуализировать инструкции при перех;В разработке ЧТЗ;ERP_KFSCH;20.07.2021;25.02.2022;16.11.2021;24.06.2022;220
5500029818;728 Уточнить необходимость! Для документ;Проверка Координатором;ERP_KFSCH;20.07.2021;04.08.2021;22.11.2021;05.12.2021;13
5500029819;480 Формирование инв. описей по остаточн;Отклонен;ERP_KFSCH;20.07.2021;-;;;-
5500029820;655 Разработка тех роли для регзадания Р;Согласование оценки Арх ИТ-реш;ERP_KFSCH;20.07.2021;29.12.2021;11.11.2021;20.04.2022;160
5500029821;Разработка и реализацияфункционала делег;В разработке ЧТЗ;WEB_TUTOR;20.07.2021;30.12.2021;17.12.2021;29.05.2022;163
5500029822;Доработать отчеты: Штатное расписание по;В разработке ЧТЗ;ZUP;20.07.2021;17.06.2022;21.02.2022;19.01.2023;332
5500029824;Доработка транзакции ZHR_OVERDRAFT;Закрыт;SAP_HR;20.07.2021;-;;;-
5500029825;Предоставление сертификата доверенного у;Отклонен; ;20.07.2021;-;;;-
5500029826;Доработка «ЕСОН ШД». Установка таймаутов;Закрыт;ESON_SHD;21.07.2021;-;;;-
5500029827;Перевод интеграции ЗУП 2.5 - СДО Перимет;В разработке ЧТЗ;ZUP;21.07.2021;15.04.2022;22.02.2022;17.11.2022;268
5500029828;Автоматизация анализа рентабельности по;В работе;ASBULOGIST;21.07.2021;31.01.2022;03.12.2021;15.06.2022;194
5500029829;Автоматическая рассылка уведомлений о на;Отклонен;OFERTA;21.07.2021;-;;;-
5500029830;Подключить систему «ЗУП 2.5 ГПН-Савицки;Отклонен;SUID;21.07.2021;-;;;-
5500029831;Синхронизация справочников системы ИСУП;В разработке ЧТЗ;ISUP_GPN;21.07.2021;28.02.2022;31.12.2021;10.08.2022;222
5500029832;Развитие функциональности/обновление реш;Закрыт;WEBSITEPOZ;21.07.2021;-;;;-
5500029833;1201_Ш-12.06.02-01 Обязательство о соблю;В работе;SAP_HR;21.07.2021;31.01.2022;04.01.2022;17.07.2022;194
5500029834;Обеспечить перадачу нового регистра свед;В работе;ESON;21.07.2021;30.01.2022;10.03.2022;19.09.2022;193
5500029835;Доработка правил СПО-1 в разделе 03.00 «;Отклонен;SBNP;22.07.2021;-;;;-
5500029836;Доработка правил СПО-1 в разделе 03.00 «;Отклонен;KSHD;22.07.2021;-;;;-
5500029840;Отключение бесшовной интеграции с ДОБ 2.;В ожидании акта от подрядчика;ERP_KFSCH;29.07.2021;22.03.2022;01.11.2021;22.03.2022;140
5500029841;в отчете о поставке газа (транзакция zga;В работе;SBYT;21.07.2021;21.02.2022;08.12.2021;11.07.2022;215
5500029844;Доработки в АС «Планирование»;В разработке ЧТЗ;OFERTA;22.07.2021;31.12.2021;04.01.2022;15.06.2022;162
5500029845;Необходимо произвести перенос элементов;В разработке ЧТЗ;ZUP;22.07.2021;29.04.2022;23.02.2022;01.12.2022;281
5500029846;697_Аналитики ОС и КС (ФД 55,56,59) - Об;В ожидании акта от подрядчика;ERP_KFSCH;22.07.2021;21.02.2022;25.10.2021;21.02.2022;118
5500029847;Оптимизация кода проведения документа ПУ;Согласование оценки Арх ИТ-реш;ERP_KFSCH;22.07.2021;30.12.2021;13.11.2021;21.04.2022;159
5500029848;Нужно переделать отчет в 1с УПП. Сделать;В разработке ЧТЗ;UPP_NS;22.07.2021;28.02.2022;25.11.2021;04.07.2022;221
5500029849;Необходимо организовать интеграцию и пер;Отклонен;SAP_HR;22.07.2021;-;;;-
5500029850;771 Автоматизировать процесс мониторинга;Закрыт;SKIB;22.07.2021;-;;;-
5500029851;При создании заказов на закупку услуг (т;Отклонен;SAPFIR;22.07.2021;-;;;-
5500029852;Разработка личного кабинета рабочего;Согласование ЧТЗ Инициатором;WEB_TUTOR;27.07.2021;29.11.2021;24.12.2021;28.04.2022;125
5500029853;справочник Карта проводок в КСУ НСИ;В разработке ЧТЗ;NSI_BEF;27.07.2021;30.12.2021;10.02.2022;16.07.2022;156
5500029854;димо включить базу ГПН БТ ЮГ в Метод Шаб;В разработке ЧТЗ;KSU_NSI;27.07.2021;21.01.2022;04.04.2022;29.09.2022;178
5500029855;Тип системы Оповещение за сутки представ;В работе;OFERTA;27.07.2021;18.02.2022;28.12.2021;22.07.2022;206
5500029856;Реализация возможности выгрузки утвержде;В разработке ЧТЗ;AS_PLANZAK;27.07.2021;31.12.2021;17.03.2022;21.08.2022;157
5500029857;Загрузка ЕПС и его аналитик;В работе;NSI_BEF;28.07.2021;28.12.2021;30.01.2022;02.07.2022;153
5500029858;Доработка интеграции с КСУ НСИ на переда;Передача в работу;SAP_HR;28.07.2021;16.12.2021;12.01.2022;01.06.2022;140
5500029859;Автопродление;Приемка Сервис Менеджером;OFERTA;28.07.2021;12.01.2022;25.12.2021;07.06.2022;164
5500029860;Реализация шаблона для дашборда в АС «От;Реализовано;OFERTA;28.07.2021;31.12.2021;27.12.2021;30.05.2022;154
5500029861;Ведение контрагентов в продуктиве SAP HR;В разработке ЧТЗ;SAP_HR;22.07.2021;14.11.2021;17.01.2022;12.05.2022;115
5500029862;1201_АвтоматичГенерЛимитаНаОтпускИнвалид;Отклонен;SAP_HR;23.07.2021;-;;;-
5500029863;Интерфейсы SAP для Оптиплан;В разработке ЧТЗ;OFERTA;23.07.2021;31.12.2021;05.01.2022;15.06.2022;161
5500029864;Подключить систему «ЗУП 2.5 ГПН-Савицки;В согласовании.Владелец шаблона;SUID;23.07.2021;28.07.2021;02.04.2022;05.04.2022;3
5500029865;Доработка вывода наименования нефтепроду;Закрыт;SAPFIR;23.07.2021;-;;;-
5500029866;Развитие функциональности/обновление реш;Закрыт;WEBSITEPOZ;23.07.2021;-;;;-
5500029867;Доработка веб-сервиса SKIB_DataEmployees;В разработке ЧТЗ;KSU_NSI;23.07.2021;11.02.2022;31.03.2022;20.10.2022;203
5500029868;Организация доступа к шаблонам МТО через;Отклонен;SUDIR;26.07.2021;-;;;-
5500029869;Замена шрифта DINPRO на бесплатный PT SA;В ожидании акта от подрядчика;CREPIS;26.07.2021;17.02.2022;18.12.2021;17.02.2022;61
5500029870;Передача данных из кадровых источников;В разработке ЧТЗ;NSI_ESST;26.07.2021;25.03.2022;09.02.2022;09.10.2022;242
5500029871;Создание раздела по рискам;В ожидании акта от подрядчика;SURNSH;26.07.2021;28.03.2022;22.10.2021;28.03.2022;157
5500029873;Если в таблице маршрутизации для Изменен;Закрыт;KSUIT;26.07.2021;-;;;-
5500029874;Обновление дизайна и функционала раздела;В ожидании акта от подрядчика;PORTAL_DIT;26.07.2021;25.03.2022;13.11.2021;25.03.2022;132
5500029875;В связи с сокращением сроков БЗ необходи;Закрыт;SAPFIR;26.07.2021;-;;;-
5500029876;Реализовать возможность переклассификаци;В ожидании акта от подрядчика;KSUIT;26.07.2021;11.03.2022;29.11.2021;11.03.2022;101
5500029877;Предосталение еженедельной выгрузки пасп;В разработке ЧТЗ;SAP_HR;26.07.2021;12.11.2021;21.01.2022;10.05.2022;109
5500029879;Интеграция ИС Церера с системой КЛАД DW;Оценка объема работ;CERERA;26.07.2021;11.01.2022;08.04.2022;19.09.2022;164
5500029880;Автоматическая рассылка актов сверки вза;Проверка Координатором;SARP;27.07.2021;03.11.2021;16.01.2022;23.04.2022;97
5500029881;Внесение изменений в роль;В разработке ЧТЗ;OFERTA;27.07.2021;31.12.2021;09.01.2022;15.06.2022;157
5500029882;Поддержка типового функционала прослежив;В ожидании акта от подрядчика;ERP_KFSCH;27.07.2021;25.01.2022;30.10.2021;25.01.2022;86
5500029883;Доработка интеграции между СЭД Тесса и С;В разработке ЧТЗ;SPPR_BLPS;27.07.2021;19.11.2021;26.07.2022;18.11.2022;115
5500029884;Контроль и отключение регламентных задан;В работе;SKIB;27.07.2021;31.01.2022;10.12.2021;16.06.2022;188
5500029885;Создание роли для консультантов в расшир;В разработке ЧТЗ;SAPFIR;27.07.2021;13.01.2022;10.01.2022;29.06.2022;170
5500029886;Создание инструмента перепроведения цепо;В разработке ЧТЗ;ERP_KFSCH;27.07.2021;28.04.2022;23.11.2021;25.08.2022;275
5500029887;Настройки временной привязки в ИТ 9014 (;Закрыт;SAP_HR;27.07.2021;-;;;-
5500029888;Изменения в формирование отчета ZFI_RMMO;Отклонен;SAPFIR;27.07.2021;-;;;-
5500029890;Миграция номеров телефонов из 0006ИТ;Закрыт;SAP_HR;27.07.2021;-;;;-
5500029891;Создание программ для изменения связи ро;В ожидании акта от подрядчика;SYSTEM_AUT;27.07.2021;09.03.2022;01.04.2022;09.03.2022;-
5500029892;Реализация контрольных процедур по проце;Отклонен;SAP_HR;27.07.2021;-;;;-
5500029893;Ведение признака рассылки для корпоратив;В разработке ЧТЗ;KSU_NSI;27.07.2021;19.04.2022;04.04.2022;26.12.2022;266
5500029894;Доработка тр. ZINPLZ010;В работе;OFERTA;27.07.2021;20.05.2022;28.12.2021;21.10.2022;297
5500029895;Изменение алгоритма копирования документ;Отклонен;ZUP;27.07.2021;-;;;-
5500029896;Ошибка интеграции КСУИТ - SAP SM;Закрыт;KSUIT;28.07.2021;-;;;-
5500029897;Оптимизация и устранение ошибок в КСУИТ;В ожидании акта от подрядчика;KSUIT;28.07.2021;08.12.2021;01.12.2021;08.12.2021;6
5500029899;Доработка ISSO в рамках миграции КРЕПИС;В ожидании акта от подрядчика;CREPIS;28.07.2021;22.02.2022;20.12.2021;22.02.2022;64
5500029900;Доработка Отчета по заказам УГМ;Согласование ЧТЗ ДКЗ;GO_TORO;29.07.2021;27.12.2021;30.03.2022;28.08.2022;151
5500029901;Разработка дополнительного раздела «Мод;Отклонен;POGPNSHELF;28.07.2021;-;;;-
5500029902;Апгрейд главной страницы Управления по р;Отклонен;POGPNSHELF;28.07.2021;-;;;-
5500029903;Автоматизировать учет кодов провозной пл;Оценка объема работ;ESON;28.07.2021;28.10.2021;29.03.2022;24.06.2022;87
5500029904;Адаптация программ для FCC;В работе;SAPFIR;28.07.2021;31.01.2022;30.12.2021;05.07.2022;187
5500029905;Запрет перемаршрутизации обращений от ОО;Закрыт;KSUIT;28.07.2021;-;;;-
5500029906;Разработка нового отчета «Биллинг ЕКДС»;В разработке ЧТЗ;BI_KSUIT;28.07.2021;31.01.2022;02.05.2022;05.11.2022;187
5500029908;Витрина СМБ для интеграции с ОЭДК (СУП);В ожидании акта от подрядчика;SMB;28.07.2021;28.03.2022;23.02.2022;28.03.2022;32
5500029909;Реализация интеграционного потока 1С Лог;В разработке ЧТЗ;TORO_NPZ;28.07.2021;14.08.2021;26.02.2022;15.03.2022;17
5500029912;Реализация интеграционного потока 1С Лог;В разработке ЧТЗ;KSHD;28.07.2021;30.01.2022;29.03.2022;01.10.2022;186
5500029913;Модернизация справочника ОКПД2 по автома;Оценка объема работ;KSHD;29.07.2021;22.10.2021;30.03.2022;18.06.2022;80
5500029914;Изменение пакетного задания Job_CCM_NSIP;В работе;KSHD;29.07.2021;28.01.2022;18.03.2022;17.09.2022;183
5500029915;Изменения алгоритма формирования техниче;Закрыт;SAPFIR;30.07.2021;-;;;-
5500029917;Доработка модуля «ПиНТ» (портал «СРЗ»);Согласование ЧТЗ ВБР;SRZ;30.07.2021;29.12.2021;11.02.2022;13.07.2022;152
5500029920;Добавление колонок первоначальному номер;Отклонен;OFERTA;30.07.2021;-;;;-
5500029921;Изменение пакетного задания Job_CCM_NSIP;Согласование ЧТЗ ВБР;KSHD;29.07.2021;28.12.2021;30.03.2022;29.08.2022;152
5500029922;Расширение МС26,МС28 складов WMS на новы;Отклонен;OFERTA;29.07.2021;-;;;-
5500029923;Доработка функционала ведения обязательн;В разработке ЧТЗ;NSI_ESMUR;29.07.2021;30.12.2021;12.02.2022;16.07.2022;154
5500029924;Проверка заполнения атрибута «Категория;Оценка объема работ;NSI_ESMUR;29.07.2021;08.12.2021;12.02.2022;19.06.2022;127
5500029925;Поставка ФО в ПАО ГП (поток КиЗ);В работе;KSHD;30.07.2021;31.12.2021;19.03.2022;20.08.2022;154
5500029926;Поставка ФО в ПАО ГП (поток справочники);В работе;KSHD;30.07.2021;31.03.2022;19.03.2022;18.11.2022;244
5500029927;Доработка функционала сбора потребностей;Закрыт;WEB_TUTOR;02.08.2021;-;;;-
5500029928;Начисление группового резерва;В работе;SAPFIR;02.08.2021;31.12.2021;04.01.2022;04.06.2022;151
5500029930;Для определения потребности в данных, не;В разработке ЧТЗ;SMA_BRD;02.08.2021;01.12.2021;27.01.2022;28.05.2022;121
5500029931;Изменение алгоритма копирования документ;Закрыт;ZUP;29.07.2021;-;;;-
5500029932;Использование в интеграции ЗУП 3.1 – КФШ;В разработке ЧТЗ;ERP_KFSCH;29.07.2021;31.12.2021;25.11.2021;29.04.2022;155
5500029933;Контрагент для ОКО в КХД БЭ;Отклонен;TC_MSFO;29.07.2021;-;;;-
5500029934;Отражение процентов по займам в 2-х БЕ;Отклонен;SAPFIR;29.07.2021;-;;;-
5500029935;Терминал. Доработка функционал;В работе;CREPIS;30.07.2021;28.02.2022;03.01.2022;04.08.2022;213
