5500028504;Доработка процесса изменения команды ФОП;В ожидании акта от подрядчика;IS_UPC;14.04.2021;18.03.2022;06.09.2021;18.03.2022;193
5500028505;Реализация  дашборда по текущим конкурен;Закрыт;AO_KZU;15.04.2021;-;;;-
5500028506;Добавление пользовательских дашбордов ИС;В работе;IS_UPC;15.04.2021;-;19.09.2021;та же;-
5500028507;Открытие роли для кода организатора 471;В работе;OFERTA;15.04.2021;31.01.2022;16.09.2021;04.07.2022;291
5500028508;Доработать ЛК 1С ЗУП 2.5;Закрыт;ZUP;15.04.2021;-;;;-
5500028509;Изменение ролей для RPA-роботов;Закрыт;OFERTA;15.04.2021;-;;;-
5500028510;Реализация страницы системы УИДО на корп;Закрыт;SAIT_UIDO;15.04.2021;-;;;-
5500028511;Реализация страницы системы УИДО на корп;Закрыт;SAIT_UIDO;15.04.2021;-;;;-
5500028512;Интеграция КСУИТ и SCCM (сервер Ноябрьск;Отклонен;KSUIT;15.04.2021;-;;;-
5500028513;Доработка завершения заявки в КСУ НСИ ПД;Оценка объема работ;KSU_NSI;15.04.2021;15.07.2021;22.12.2021;18.03.2022;86
5500028514;Разработка отчета Фактические трудозатра;В разработке ЧТЗ;ARM_DITAT;15.04.2021;24.12.2021;17.01.2022;27.09.2022;253
5500028515;Реализация скрипта импорта справочников;В работе;NEW_SED;15.04.2021;31.12.2021;25.11.2021;12.08.2022;260
5500028516;Интеграция ИС ИСУП ГПН с КЛАД в рамках п;Отклонен;ISUP_GPN;15.04.2021;-;;;-
5500028517;Оптимизация схемы потоков данных;В ожидании акта от подрядчика;EPKK;15.04.2021;22.03.2022;09.08.2021;22.03.2022;224
5500028518;Доработка тр. ZINMM002 поле «Дата подпис;Закрыт;OFERTA;15.04.2021;-;;;-
5500028519;(АИС УС) Выполнение работ при миграции с;Закрыт;AIS_US;15.04.2021;-;;;-
5500028520;Корпоративный интранет-портал;В ожидании акта от подрядчика;SAP_HR;15.04.2021;24.03.2022;17.09.2021;24.03.2022;188
5500028521;Модернизация СЭД АХО;В разработке ЧТЗ;SED_AHO;15.04.2021;29.04.2022;09.01.2022;23.01.2023;379
5500028522;Обновление портала SAP до версии 7.5;Отклонен;SAP_BASIS;15.04.2021;-;;;-
5500028523;Данные корректировочных фактур (кредитов;Закрыт;KHD_BEF;15.04.2021;-;;;-
5500028524;Настройка сериализации сообщений для пер;Реализовано;KSHD;16.04.2021;22.11.2021;02.12.2021;08.07.2022;218
5500028525;Необходимо произвести настройку интеграц;В ожидании акта от подрядчика;SAP_HR;20.04.2021;30.09.2021;22.09.2021;30.09.2021;8
5500028526;Необходимо произвести настройку интеграц;В ожидании акта от подрядчика;KSHD;20.04.2021;22.11.2021;26.11.2021;22.11.2021;-
5500028527;Доработка системы СБЫТ+;В ожидании акта от подрядчика;SAPFIR;21.04.2021;30.03.2022;11.09.2021;30.03.2022;200
5500028528;Добработка оповещений в заявках ЕКИ НСИ;В работе;NSI_BEF;21.04.2021;11.02.2022;24.10.2021;16.08.2022;296
5500028529;Отчет ZINMM525;В работе;OFERTA;21.04.2021;15.02.2022;22.09.2021;19.07.2022;300
5500028530;Создание ролей для работы с ведомостью м;В разработке ЧТЗ;OFERTA;21.04.2021;31.12.2021;04.10.2021;15.06.2022;254
5500028531;Разработка WEB-сервиса для выгрузки данн;В работе;KSHD;15.04.2021;18.03.2022;03.12.2021;05.11.2022;337
5500028533;Обеспечение передачи данных об отгрузках;В ожидании акта от подрядчика;ESON;16.04.2021;28.12.2021;22.11.2021;28.12.2021;35
5500028534;Кастомизированная форма записи на вакцин;Закрыт;ZAP_MED;16.04.2021;-;;;-
5500028535;Необходимо произвести настройку интеграц;Закрыт;ZUP;16.04.2021;-;;;-
5500028536;Написание документации по порталу HSE;Закрыт;PORTAL_HSE;16.04.2021;-;;;-
5500028537;Создание ролей для работы в АС «Планиров;Закрыт;OFERTA;16.04.2021;-;;;-
5500028538;Расширение интеграционного решения SAP –;В ожидании акта от подрядчика;ISPK_GPN_R;16.04.2021;14.12.2021;24.12.2021;14.12.2021;-
5500028539;Автоматизация отправки уведомлений сотру;В разработке ЧТЗ;WEB_TUTOR;16.04.2021;30.12.2021;13.09.2021;29.05.2022;258
5500028540;Редизайн функционала учета фактов пройде;Закрыт;WEB_TUTOR;16.04.2021;-;;;-
5500028541;Реализация интеграции 1С ЗУП 3 с ЕРП КФШ;В ожидании акта от подрядчика;ERP_KFSCH;16.04.2021;09.02.2022;20.07.2021;09.02.2022;203
5500028542;Добавление дополнительных строк выбора д;Закрыт;OFERTA;16.04.2021;-;;;-
5500028543;Возможность просмотра сторнированной цеп;В разработке ЧТЗ;OFERTA;16.04.2021;31.12.2021;29.09.2021;15.06.2022;259
5500028544;Добавление новых условий в работу функци;Закрыт;KSUIT;16.04.2021;-;;;-
5500028545;Необходимо изменить алгоритм расчета сре;В ожидании акта от подрядчика;ZUP;16.04.2021;30.03.2022;25.10.2021;30.03.2022;156
5500028546;Активация СУС;Закрыт;OFERTA;16.04.2021;-;;;-
5500028547;Необходимо изменить алгоритм применения;Приемка Сервис Менеджером;ZUP;16.04.2021;27.12.2021;02.11.2021;11.07.2022;251
5500028548;Автоматизация в системе САП процесса уче;В работе;SAPFIR;16.04.2021;28.02.2022;18.09.2021;02.08.2022;318
5500028550;Доработка функционала в части открытия/з;Отклонен;OFERTA;19.04.2021;-;;;-
5500028551;Добавить новое поле в АС Отчетность (эко;Закрыт;OFERTA;19.04.2021;-;;;-
5500028552;Расширение интеграционного решения SAP –;В ожидании акта от подрядчика;SAPFIR;19.04.2021;16.03.2022;09.09.2021;16.03.2022;188
5500028553;Расширение интеграционного решения SAP –;Закрыт;OFERTA;19.04.2021;-;;;-
5500028554;Анализ бизнес процессов в системе Celoni;В разработке ЧТЗ;SUAP_BEF;19.04.2021;31.12.2021;19.11.2021;02.08.2022;256
5500028555;Внесение изменений в типовые формы догов;В работе;OFERTA;19.04.2021;24.12.2021;20.09.2021;27.05.2022;249
5500028556;Автоматизировать учет кодов провозной пл;В разработке ЧТЗ;SBYT;19.04.2021;15.01.2022;18.09.2021;16.06.2022;271
5500028557;(ШУЗ) Доработка функционала создания зак;Закрыт;OFERTA;19.04.2021;-;;;-
5500028558;Реализация  дашборда по текущим конкурен;В ожидании акта от подрядчика;OFERTA;19.04.2021;20.12.2021;08.09.2021;20.12.2021;102
5500028559;Поставить контроль во входящей поставке;В разработке ЧТЗ;OFERTA;19.04.2021;31.12.2021;02.10.2021;15.06.2022;256
5500028560;Корректировка фактической добычи ПНГ ООО;Закрыт;OIS_PLUS;20.04.2021;-;;;-
5500028561;414 Ограничение корректировки Категории;В ожидании акта от подрядчика;ERP_KFSCH;20.04.2021;27.08.2021;24.07.2021;27.08.2021;33
5500028562;Признак специальной таможенной процедуры;В разработке ЧТЗ;OFERTA;20.04.2021;24.12.2021;03.10.2021;08.06.2022;248
5500028563;На экране поиска заявок необходимо поста;Отклонен; ;20.04.2021;-;;;-
5500028564;Изменение формы CЗВ-ТД;Закрыт;ZUP;20.04.2021;-;;;-
5500028565;Изменение формы CЗВ-ТД;Закрыт;ZUP;20.04.2021;-;;;-
5500028566;Разработка макетов страниц по функционал;Закрыт;WEB_TUTOR;20.04.2021;-;;;-
5500028567;Разработка интеграции между хранилищем д;Оценка объема работ;OIS_USOI;20.04.2021;24.06.2021;22.11.2021;21.01.2022;60
5500028568;ТА Поставщиков МТР: корректировка функци;Закрыт;OFERTA;20.04.2021;-;;;-
5500028569;Периодичность 3 года для ОО по ПДМ и ПДМ;Закрыт;ZUP;20.04.2021;-;;;-
5500028570;Планирование при запуске сообщения D1/D2;В разработке ЧТЗ;TORO_NPZ;20.04.2021;18.05.2021;19.11.2021;17.12.2021;28
5500028571;Автоматизировать процесс обновления ИС «;В разработке ЧТЗ;SHAHMATKA;20.04.2021;30.04.2022;05.02.2022;15.02.2023;375
5500028572;Создание песочницы под управлением СУБД;В работе;SAP_BASIS;21.04.2021;31.12.2021;11.12.2021;22.08.2022;254
5500028573;Доработка решения SAP TORO;Закрыт;TORO_NPZ;21.04.2021;-;;;-
5500028574;Создание роли для RPA-робота;В ожидании акта от подрядчика;OFERTA;21.04.2021;06.12.2021;10.09.2021;06.12.2021;86
5500028575;Создание печатных форм при присоединении;Проверка Координатором;ZUP;21.04.2021;20.12.2021;29.11.2021;28.07.2022;241
5500028576;Настройка интеграции с ARIS ДРП и BI ДРП;Отклонен;KSU_NSI;21.04.2021;-;;;-
5500028577;Развитие интеграции PM и MM;В разработке ЧТЗ;TORO_NPZ;21.04.2021;16.07.2021;20.11.2021;14.02.2022;86
5500028578;1201 Доработка приказа о переводе. Оформ;Закрыт;SAP_HR;21.04.2021;-;;;-
5500028579;Доработка ZPMR;Закрыт;TORO_NPZ;21.04.2021;-;;;-
5500028580;Расширение на склад СУС;Закрыт;AIS_US;21.04.2021;-;;;-
5500028581;Отчет по срокам согласования технически;Закрыт;OFERTA;21.04.2021;-;;;-
5500028582;Печатные формы для Увольнения из организ;Отклонен;ZUP;21.04.2021;-;;;-
5500028584;Доработка механизмов системы для целей с;Закрыт;KOMN_DANN;22.04.2021;-;;;-
5500028585;Автоматизация поставки данных в КЛАД;В ожидании акта от подрядчика;KLAD;22.04.2021;20.12.2021;25.10.2021;20.12.2021;55
5500028586;добавление класса ОС в справочник ТОУ;Проверка Координатором;SAPFIR;22.04.2021;30.04.2021;12.10.2021;18.10.2021;6
5500028587;Реализовать добавление новых аналитик, н;Закрыт;SBYT;22.04.2021;-;;;-
5500028588;Расширение аналитики ОСВ ZUNI_OSDK БС 96;Отклонен;SAPFIR;22.04.2021;-;;;-
5500028589;Доработка  отчета ZBARCODE_01 в части ФИ;Отклонен;EHD;22.04.2021;-;;;-
5500028590;Автоматизированный отчет по оборачиваемо;Отклонен;INTSPACEZA;22.04.2021;-;;;-
5500028591;Автоматизация выравнивания;В ожидании акта от подрядчика;SAPFIR;21.04.2021;30.03.2022;11.09.2021;30.03.2022;200
5500028592;Автоматизация процесса распределения зат;Отклонен;ERP_KFSCH;21.04.2021;-;;;-
5500028593;Доработка интеграционного интерфейса Tes;Закрыт;NEW_SED;23.04.2021;-;;;-
5500028594;Миграция данных из СЭД  Lotus в Tessa Ар;В разработке ЧТЗ;NEW_SED;23.04.2021;31.03.2022;15.12.2021;22.11.2022;342
5500028595;В отчете выводимой системой SAP в транза;Закрыт;SAPFIR;23.04.2021;-;;;-
5500028596;Разработка интеграции данных системы «от;В разработке ЧТЗ;OTCH_DYAR;23.04.2021;09.07.2021;11.09.2021;27.11.2021;77
5500028597;Выгрузка единого реестра в АО ГПБ банк п;В работе;ZUP;23.04.2021;11.03.2022;13.11.2021;01.10.2022;322
5500028598;Добавление тр. SE16 в роль ZTGPN_MTO_030;В ожидании акта от подрядчика;OFERTA;23.04.2021;07.02.2022;12.09.2021;07.02.2022;147
5500028599;Выделение НДС с долгосрочной части получ;Закрыт;SAPFIR;23.04.2021;-;;;-
5500028600;Доработка Тр. ZUKS027 – добавление столб;Согласование ЧТЗ Инициатором;OFERTA;23.04.2021;08.12.2021;06.10.2021;23.05.2022;229
5500028601;Оптимизация времени работы Формы 4;Приемка Сервис Менеджером;SAPFIR;22.04.2021;31.12.2021;20.09.2021;27.05.2022;249
5500028602;Изменения иерархии в SAP BW переходят в;В согласовании.Владелец шаблона;BI_BRD;22.04.2021;29.04.2021;14.04.2022;19.04.2022;5
5500028603;Установка cистемы разработки SAP Process;В ожидании акта от подрядчика;SAP_BASIS;22.04.2021;19.01.2022;30.11.2021;19.01.2022;50
5500028604;Установка cистемы качества SAP Process O;В работе;SAP_BASIS;22.04.2021;31.01.2022;12.12.2021;22.09.2022;284
5500028605;Установка cистемы тестирования SAP Proce;В работе;SAP_BASIS;22.04.2021;31.01.2022;12.12.2021;22.09.2022;284
5500028606;Установка продуктивной cистемы SAP Proce;Передача в работу;SAP_BASIS;22.04.2021;28.12.2021;13.12.2021;19.08.2022;249
5500028607;Разработка электронного отчета по сервис;В разработке ЧТЗ;KSU_NSI;22.04.2021;21.01.2022;29.12.2021;29.09.2022;274
5500028608;Изменения иерархии в SAP BW переходят в;В согласовании.Владелец шаблона;KKO;22.04.2021;25.05.2021;22.11.2021;23.12.2021;31
5500028609;Актуализация комплекта документов на СЗП;Отклонен;NEW_SED;22.04.2021;-;;;-
5500028610;Доработка Тр. ZUKS545 – добавление столб;В работе;OFERTA;22.04.2021;23.12.2021;23.09.2021;26.05.2022;245
5500028611;Вывод карты МИР в заявление и реестр ФСС;Закрыт;SAP_HR;22.04.2021;-;;;-
5500028613;Необходимо доработать отчет ZFIAA_ACT_IN;Отклонен;SAPFIR;22.04.2021;-;;;-
5500028614;Обновление формы счета-фактуры, книги пр;В разработке ЧТЗ;UPP_MB;22.04.2021;31.12.2021;08.12.2021;18.08.2022;253
5500028615;Разработка механизмов по автоматической;Закрыт;KSHD;22.04.2021;-;;;-
5500028616;Обновление формы счета-фактуры, книги пр;Отклонен; ;22.04.2021;-;;;-
5500028617;Обновление формы счета-фактуры, книги пр;Отклонен;UPP_ITSK;22.04.2021;-;;;-
5500028618;Обновление формы счета-фактуры, книги пр;Отклонен; ;22.04.2021;-;;;-
5500028619;Обновление формы счета-фактуры, книги пр;Отклонен; ;22.04.2021;-;;;-
5500028620;Обновление формы счета-фактуры, книги пр;Отклонен; ;22.04.2021;-;;;-
5500028621;Функциональное расширение системы отчетн;Отклонен;KSU_NSI;23.04.2021;-;;;-
5500028622;Устранение избыточных полномочий в просм;Приемка Сервис Менеджером;OFERTA;23.04.2021;03.12.2021;20.09.2021;28.04.2022;220
5500028623;Устранение избыточных полномочий в просм;Отклонен;SBYT;23.04.2021;-;;;-
5500028624;"615 Доработка отчета ""Контроль остатков";В ожидании акта от подрядчика;ERP_KFSCH;23.04.2021;28.09.2021;27.07.2021;28.09.2021;62
5500028625;626 Техническое задание для 1С ERP НТЦ R;В ожидании акта от подрядчика;ERP_KFSCH;23.04.2021;12.01.2022;27.07.2021;12.01.2022;168
5500028626;Исключение лишних соединений в запросе д;В ожидании акта от подрядчика;NSI_ESMUR;26.04.2021;30.03.2022;17.10.2021;30.03.2022;164
5500028627;"Оптимизация функционала ""Панель поиска""";В разработке ЧТЗ;NSI_ESMUR;26.04.2021;21.01.2022;10.11.2021;07.08.2022;270
5500028628;Создание новых реквизитов  «Наименование;В разработке ЧТЗ;NSI_ESMUR;26.04.2021;25.02.2022;10.11.2021;11.09.2022;305
5500028629;Подписание инвентаризационных описей (и;Отклонен;SAPFIR;26.04.2021;-;;;-
5500028631;Расширение учитываемых для НУ расходов;Отклонен;SAPFIR;26.04.2021;-;;;-
5500028632;Необходимо реализовать механизм передачи;В разработке ЧТЗ;EKUZ;26.04.2021;11.06.2021;18.10.2021;03.12.2021;46
5500028633;Разработка макетов интерфейса типовых фо;В работе;LKK_BLPS;26.04.2021;09.08.2021;31.10.2021;13.02.2022;105
5500028634;Разработка html-верстки интерфейса опрос;Закрыт;LKK_BLPS;26.04.2021;-;;;-
5500028635;Интеграия SAP SM 7.2 и  Terrasoft Creati;Закрыт;KSHD;26.04.2021;-;;;-
5500028636;Интеграия SAP SM 7.2 и  HPE SM(КСУИТ;Закрыт;KSHD;26.04.2021;-;;;-
5500028637;Отразить информацию о линейном и функцио;В разработке ЧТЗ;NSI_ESST;26.04.2021;28.01.2022;10.11.2021;14.08.2022;277
5500028638;Интеграия SAP SM 7.2 и  HPE SM(КСУИТ;Закрыт;KSUIT;26.04.2021;-;;;-
5500028639;Устранение избыточных полномочий в просм;В ожидании акта от подрядчика;TORO_NPZ;27.04.2021;08.02.2022;02.11.2021;08.02.2022;98
5500028640;Обновление ПО SAP EPM+Analysis;Отклонен;SAP_BASIS;27.04.2021;-;;;-
5500028641;Доработка экранов подтипов 3273 ИТ (C-59;Отклонен;SAP_HR;26.04.2021;-;;;-
5500028642;1201 Изменение Мероприятий и приказов об;Закрыт;SAP_HR;26.04.2021;-;;;-
5500028644;Доработка правил СПО-1 в разделе 03.00 «;Отклонен;SPO;27.04.2021;-;;;-
5500028645;Скорректировать логику проверки заполнен;Закрыт;KSUIT;27.04.2021;-;;;-
5500028646;Реализация настраиваемых уведомлений в;В работе;OFERTA;27.04.2021;30.12.2021;28.09.2021;02.06.2022;247
5500028647;Дублирование сч/ф  к одному ПУД, что вле;Отклонен;OFERTA;27.04.2021;-;;;-
5500028648;Добавление в СУИД дополнительного маршру;В разработке ЧТЗ;SUID;27.04.2021;01.06.2022;01.01.2022;05.02.2023;400
5500028650;Разработать передачу плановых начислений;Закрыт;ZUP;27.04.2021;-;;;-
5500028651;Приведение механизма обмена «ЕСОН-АРМ» А;В разработке ЧТЗ;ESON;27.04.2021;07.02.2022;27.12.2021;09.10.2022;286
5500028652;Доработка «ЕСОН-АРМ» ЖД в части передачи;В ожидании акта от подрядчика;ESON;27.04.2021;19.10.2021;03.12.2021;19.10.2021;-
5500028653;Расчет НДФЛ 15% по совместителям и ГПХ;В работе;SAP_HR;27.04.2021;28.12.2021;11.10.2021;13.06.2022;245
5500028654;1.В печатной форме Приложения к форме ИН;Отклонен;SAPFIR;27.04.2021;-;;;-
5500028655;Необходимо изменить алгоритм расчета  НД;Приемка Сервис Менеджером;ZUP;27.04.2021;28.12.2021;13.11.2021;12.07.2022;241
5500028656;Необходимо изменить алгоритм расчета вып;Приемка Сервис Менеджером;ZUP;27.04.2021;27.12.2021;13.11.2021;11.07.2022;240
5500028657;Добавление в шаблон ZINMM509 Дефицитная;Отклонен;OFERTA;27.04.2021;-;;;-
5500028658;Доработка ЕСОН АРМ в части Транспортной;Приемка Сервис Менеджером;ESON;27.04.2021;27.12.2021;11.12.2021;08.08.2022;240
5500028660;Перемещении НВИ в транзакции ZINMM010;Отклонен;OFERTA;28.04.2021;-;;;-
5500028661;Проектирование количественного учёта пер;Проверка Координатором;OFERTA;28.04.2021;20.09.2021;17.10.2021;09.03.2022;143
5500028662;Обеспечение передачи данных об отгрузках;В ожидании акта от подрядчика;ESON_SHD;28.04.2021;29.11.2021;13.08.2021;29.11.2021;108
5500028663;Обеспечение обмена данных по бункеровщик;В разработке ЧТЗ;UPP_MB;28.04.2021;17.05.2021;14.12.2021;02.01.2022;19
5500028664;Доработка потока данных основных средств;Закрыт;KHD_BEF;29.04.2021;-;;;-
5500028665;Автоматизация 4П. Разграничение доступов;Закрыт;ARM_IMUSH;29.04.2021;-;;;-
5500028666;Предоставление доступа пользователям ДО;Отклонен;MO;29.04.2021;-;;;-
5500028667;Формирование и проведение транспортных з;В работе;OFERTA;29.04.2021;31.03.2022;30.09.2021;01.09.2022;336
5500028668;Уведомления по сроку хранения;Согласование ЧТЗ ДКЗ;OFERTA;29.04.2021;30.12.2021;12.10.2021;14.06.2022;245
5500028669;Сервис записи на мероприятие;В разработке ЧТЗ;SED_AHO;30.04.2021;30.12.2021;24.01.2022;25.09.2022;244
5500028670;Доработка отчёта «Показатели доступности;В разработке ЧТЗ;BI_KSUIT;30.04.2021;24.12.2021;02.02.2022;28.09.2022;238
5500028671;Аналитика фонда CV-19 в авансовых отчета;Закрыт;SAPFIR;28.04.2021;-;;;-
5500028672;"До настройка отчета ""Командировочные рас";В разработке ЧТЗ;SAP_HR;28.04.2021;08.10.2021;24.10.2021;05.04.2022;163
5500028673;Снятие ограничений по банку;Закрыт;SAPFIR;28.04.2021;-;;;-
5500028674;Обновление решения Статистика посещаемос;В разработке ЧТЗ;STAT_POS;28.04.2021;14.05.2021;28.11.2021;14.12.2021;16
5500028675;Обновление решения Статистика посещаемос;В разработке ЧТЗ;STAT_POS;28.04.2021;14.05.2021;28.11.2021;14.12.2021;16
5500028676;Создание ролей для RPA-роботов;В ожидании акта от подрядчика;SAPFIR;28.04.2021;10.03.2022;18.09.2021;10.03.2022;173
5500028677;Изменение расчета Недоработки при СУРВ;Закрыт;ZUP;28.04.2021;-;;;-
5500028678;Реализация доработко по созданию инструм;Отклонен;BI_BEF;28.04.2021;-;;;-
5500028679;Добавления информационых полей в тр. SBW;Закрыт;SAPFIR;28.04.2021;-;;;-
5500028680;Необходимо произвести настройку интеграц;Отклонен;ZUP;28.04.2021;-;;;-
5500028681;Интеграция данных из СЭД НМД (Lotus Note;В разработке ЧТЗ;KHD_HR;28.04.2021;31.01.2022;28.10.2021;02.08.2022;278
5500028682;Изменение маршрута согласования ГПН-ТП;Закрыт;SAP_ESS_HR;28.04.2021;-;;;-
5500028683;Обеспечение обмена данных по НСИ, заявка;В разработке ЧТЗ;UPP_MB;28.04.2021;17.05.2021;14.12.2021;02.01.2022;19
5500028684;Обеспечение обмена данных по НСИ и паспо;В разработке ЧТЗ;UPP_MB;28.04.2021;17.05.2021;14.12.2021;02.01.2022;19
5500028685;Обеспечение передачи данных по остаткам;Согласование ЧТЗ Архитектором;ASMU;28.04.2021;18.10.2021;07.12.2021;29.05.2022;173
