5500030701;Доработка интеграционного решения СЭД «K;Согласование ЧТЗ Инициатором;NEW_SED;23.09.2021;-;17.05.2022;та же;-
5500030702;Экспертиза организационных и стратегичес;Согласование Менеджером проц-а;ISUP_GPN;24.09.2021;30.12.2021;25.02.2022;31.05.2022;95
5500030703;Экспертиза организационных и стратегичес;В ожидании акта от подрядчика;ISUP_GPN;24.09.2021;29.03.2022;10.02.2022;29.03.2022;46
5500030704;Экспертиза организационных и стратегичес;В ожидании акта от подрядчика;ISUP_GPN;24.09.2021;29.03.2022;10.02.2022;29.03.2022;46
5500030705;Доработки карточек мероприятий по запрос;В ожидании акта от подрядчика;ISUP_GPN;24.09.2021;29.03.2022;10.02.2022;29.03.2022;46
5500030706;Доработки карточек ИТАТ-проектов по запр;В ожидании акта от подрядчика;ISUP_GPN;24.09.2021;30.03.2022;10.02.2022;30.03.2022;47
5500030708;Модели данных Qlik Sence и Qlik View  по;Согласование Менеджером проц-а;ISUP_GPN;24.09.2021;29.12.2021;25.02.2022;30.05.2022;94
5500030709;Доработка ЖЦ ЦП и Упрощение версионности;В ожидании акта от подрядчика;ISUP_GPN;24.09.2021;29.03.2022;10.02.2022;29.03.2022;46
5500030710;Доработки карточек цифровых проектов по;В ожидании акта от подрядчика;ISUP_GPN;24.09.2021;29.03.2022;10.02.2022;29.03.2022;46
5500030711;Доработка системы Sap Portal в части соз;Отклонен;SAPFIR;24.09.2021;-;;;-
5500030712;Интеграция с системой «Аналоги» (Смарт М;В разработке ЧТЗ;NSI_ESMUR;24.09.2021;25.02.2022;10.04.2022;11.09.2022;154
5500030713;Создание роли RPA-робота «Проверка перви;В разработке ЧТЗ;OFERTA;24.09.2021;30.12.2022;09.03.2022;14.06.2023;462
5500030714;Добавление грейда в отчет по приемам, пе;Согласование ЧТЗ ДЗКСУ;SAP_HR;24.09.2021;30.12.2021;22.03.2022;27.06.2022;97
5500030715;Оптимизация скорости передачи данных из;В работе;SAP_HR;24.09.2021;18.01.2022;10.03.2022;04.07.2022;116
5500030717;Доработка отчета Документы ЮЗЭДО;В разработке ЧТЗ;UPP_MB;24.09.2021;20.01.2022;12.05.2022;07.09.2022;118
5500030719;Автоматизация отчета по ЭДО;В работе;OFERTA;24.09.2021;15.02.2022;25.02.2022;19.07.2022;144
5500030720;Необходимо настроить прямую интеграцию п;В разработке ЧТЗ;SAP_HR;24.09.2021;31.12.2021;22.03.2022;28.06.2022;98
5500030721;SAP HANA ВПД 2.0;В работе;SAP_BASIS;24.09.2021;30.12.2021;16.05.2022;21.08.2022;97
5500030722;825 (ЧТЗ 11.) Основные средства и объект;В ожидании акта от подрядчика;ERP_KFSCH;24.09.2021;22.03.2022;28.12.2021;22.03.2022;83
5500030724;изменения в транзикции ZITSKMM501 – Отче;В разработке ЧТЗ;OFERTA;27.09.2021;31.12.2021;12.03.2022;15.06.2022;95
5500030725;822 Отчеты: разработать для Комплекс Пар;В ожидании акта от подрядчика;ERP_KFSCH;27.09.2021;09.03.2022;31.12.2021;09.03.2022;67
5500030727;Интеграция Электронного журнала контроля;Проверка Координатором; ;28.09.2021;30.09.2021;нет БР;нет БР;-
5500030728;689_Налог на прибыль_Часть 1(ФД 27);В работе;ERP_KFSCH;28.09.2021;30.01.2022;13.01.2022;17.05.2022;124
5500030729;"Выгрузка метаданных из 1С УПП МБ; 1С УПП";Отклонен;UPP_MB;28.09.2021;-;;;-
5500030730;"Выгрузка метаданных из 1С ТОиР МБ; 1С ОС";Отклонен;TOIR_BUNKE;28.09.2021;-;;;-
5500030731;Отчет количество отработанных заявок;В разработке ЧТЗ;NSI_ESMUR;27.09.2021;08.04.2022;13.04.2022;23.10.2022;193
5500030732;Доработка транзакции  MIGO в части допол;В разработке ЧТЗ;OFERTA;27.09.2021;31.12.2021;12.03.2022;15.06.2022;95
5500030734;В рамках участия в конкурентных процедур;Проверка Координатором;OFERTA;27.09.2021;11.10.2021;18.03.2022;30.03.2022;12
5500030737;Доработка в транзакции zuks026 ИС САП .;В работе;OFERTA;27.09.2021;04.02.2022;28.02.2022;08.07.2022;130
5500030738;Оптимизация скорости передачи данных из;В работе;KSHD;27.09.2021;18.01.2022;17.05.2022;07.09.2022;113
5500030741;Интеграция систем ЗУП – Аэродромная логи;В разработке ЧТЗ;ZUP;28.09.2021;29.07.2022;02.05.2022;02.03.2023;304
5500030742;Учет ТРЗ. Адаптация функциональности для;Согласование ЧТЗ ВБР;SEVBB;28.09.2021;30.12.2021;23.04.2022;25.07.2022;93
5500030743;Интеграция с системой «Аналоги» (Смарт М;В разработке ЧТЗ;KSHD;28.09.2021;31.03.2022;30.05.2022;30.11.2022;184
5500030744;627_Формировании стоимости объектов осно;В работе;ERP_KFSCH;28.09.2021;30.12.2021;13.01.2022;16.04.2022;93
5500030745;Экспорт данных в КСУ НСИ ЕСИС из СУК;В разработке ЧТЗ;KSU_NSI;28.09.2021;18.03.2022;06.06.2022;24.11.2022;171
5500030746;Создание механизма переноса HR данных ГП;В работе;SAP_HR;28.09.2021;31.01.2022;14.03.2022;17.07.2022;125
5500030747;Update SAP Fiori Stack sps8;В работе;SAP_BASIS;29.09.2021;01.03.2022;21.05.2022;21.10.2022;153
5500030748;Система отчетов по ИТ-сервисам «Айсберг»;В разработке ЧТЗ;BI_BLPS;29.09.2021;12.11.2021;09.04.2022;23.05.2022;44
5500030749;Автоматическое присвоение ОКВЭД2 в справ;В разработке ЧТЗ;NSI_ESMUR;29.09.2021;01.04.2022;15.04.2022;16.10.2022;184
5500030750;Нагрузочное тестирование КШ на платформе;Отклонен;ERP_KFSCH;29.09.2021;-;;;-
5500030751;710 ПРОСЛЕЖИВАЕМОСТЬ Форматы журнала уче;Приемка Сервис Менеджером;ERP_KFSCH;28.09.2021;29.12.2021;09.01.2022;07.04.2022;88
5500030752;Обновление ревизии SAP TREX;Закрыт;SAP_BASIS;28.09.2021;-;;;-
5500030753;Расширить поле «заводской номер» в карто;В согласовании.Дополн. участник согласования;SAPFIR;28.09.2021;04.10.2021;18.03.2022;22.03.2022;4
5500030754;Привести в соответствие отчетные формы с;В работе;OIS_PIPE;28.09.2021;24.12.2021;26.08.2022;21.11.2022;87
5500030755;Необходимо в модуле «Планирование програ;В работе;OIS_PIPE;28.09.2021;24.12.2021;26.08.2022;21.11.2022;87
5500030756;Необходимо реализовать учет протяженност;В работе;OIS_PIPE;28.09.2021;28.12.2021;26.08.2022;25.11.2022;91
5500030757;Необходимо в экранных формах «План-бук:;В работе;OIS_PIPE;28.09.2021;24.12.2021;26.08.2022;21.11.2022;87
5500030758;Добавить рассылку уведомлений при попада;В разработке ЧТЗ;SAPFIR;28.09.2021;20.01.2022;14.03.2022;06.07.2022;114
5500030759;Расширение функциональности «Формировани;В разработке ЧТЗ;SBYT;29.09.2021;01.02.2022;28.02.2022;03.07.2022;125
5500030760;Выгрузка метаданных из 1С АСУА Аэро, 1С;Отклонен;TOIR_AERO;29.09.2021;-;;;-
5500030761;.В печатной форме Приложения к форме ИНВ;В ожидании акта от подрядчика;SAPFIR;29.09.2021;25.03.2022;19.02.2022;25.03.2022;34
5500030762;Вывод штрих-кода зарегистрированного в с;Проверка Координатором;1CDOC2X;29.09.2021;01.12.2021;17.01.2022;19.03.2022;61
5500030763;Автоматизация проводок в ИС SAP и настро;В ожидании акта от подрядчика;OFERTA;29.09.2021;30.03.2022;18.02.2022;30.03.2022;39
5500030764;Отчет SAP для ЦИМП;В разработке ЧТЗ;KSHD;29.09.2021;17.03.2022;31.05.2022;16.11.2022;169
5500030766;Интеграция данных из 1С КСУ НСИ ПД в КХД;В разработке ЧТЗ;KHD_HR;30.09.2021;31.01.2022;01.04.2022;02.08.2022;123
5500030767;В настоящий момент в ИС 1С / Документооб;Отклонен;1CDOC2X;01.10.2021;-;;;-
5500030768;Актуализация оповещений КСУИТ;В ожидании акта от подрядчика;KSUIT;01.10.2021;10.03.2022;04.02.2022;10.03.2022;33
5500030769;Внесение изменений в настройки инструмен;В ожидании акта от подрядчика;KSUIT;01.10.2021;10.03.2022;04.02.2022;10.03.2022;33
5500030770;Шаблоны писем для внешних организаций;Закрыт;KSUIT;01.10.2021;-;;;-
5500030771;Расширение функциональности АРМ Закупщик;В работе;OFERTA;29.09.2021;25.12.2021;02.03.2022;28.05.2022;87
5500030772;База цен (АСУЗ): Реализация функциональн;В разработке ЧТЗ;OFERTA;29.09.2021;31.01.2022;14.03.2022;16.07.2022;124
5500030773;1201 Доработка формы Ш-14.03.06-31;В ожидании акта от подрядчика;SAP_HR;30.09.2021;16.03.2022;04.03.2022;16.03.2022;12
5500030774;1201 Доработка формы Ш-14.03.06-22;Закрыт;SAP_HR;30.09.2021;-;;;-
5500030775;1201 Доработка формы Ш-14.03.05-08;Приемка Сервис Менеджером;SAP_HR;30.09.2021;31.12.2021;12.03.2022;08.06.2022;88
5500030776;1201 Доработка формы Ш-14.03.05-07;Закрыт;SAP_HR;30.09.2021;-;;;-
5500030777;1201 Доработка формы Ш-14.03.05-11;Закрыт;SAP_HR;30.09.2021;-;;;-
5500030778;1201 Доработка формы Ш-14.03.06-12;В работе;SAP_HR;30.09.2021;30.12.2021;16.03.2022;15.06.2022;91
5500030779;1201 Доработка формы Ш-14.03.06-09;Отклонен;SAP_HR;30.09.2021;-;;;-
5500030780;1201 Доработка формы Ш-14.03.05-05;Приемка Сервис Менеджером;SAP_HR;30.09.2021;30.12.2021;12.03.2022;07.06.2022;87
5500030781;Доработка Вербального описания на штатно;Приемка Сервис Менеджером;SAP_HR;30.09.2021;30.12.2021;12.03.2022;07.06.2022;87
5500030782;Связь ММ-цепочки и Авансовых платежей;В разработке ЧТЗ;SAPFIR;30.09.2021;31.12.2021;16.03.2022;16.06.2022;92
5500030783;Доработка отчета ZITSKQM503;Оценка объема работ;OFERTA;30.09.2021;10.01.2022;15.03.2022;20.06.2022;97
5500030784;Новый раздел на сайте https://supply.gaz;В работе;CREPIS;30.09.2021;23.11.2021;06.03.2022;29.04.2022;54
5500030785;Автоматизация планирования расходов на 4;В согласовании.Менеджер процесса;SAPFIR;30.09.2021;10.12.2021;07.03.2022;15.05.2022;69
5500030786;Суточная добыча в КХД БЭФ;В разработке ЧТЗ;KSHD;30.09.2021;31.03.2022;01.06.2022;30.11.2022;182
5500030787;Суточная добыча в КХД БЭФ;В согласовании.Владелец шаблона;RHD_BRD;30.09.2021;06.10.2021;23.04.2022;27.04.2022;4
5500030788;Доработка функционала работы с планами к;Закрыт;WEB_TUTOR;30.09.2021;-;;;-
5500030789;Подключение нового ДО к к разделу АХО на;Отклонен;PORTALSELF;30.09.2021;-;;;-
5500030790;Номер обращения в уведомлении о согласов;В ожидании акта от подрядчика;KSUIT;30.09.2021;17.03.2022;03.02.2022;17.03.2022;41
5500030792;Уведомления о автоматическом выходе обра;В ожидании акта от подрядчика;KSUIT;30.09.2021;17.03.2022;03.02.2022;17.03.2022;41
5500030794;(ШУЗ) Запрет изменения принимающего скла;В работе;OFERTA;01.10.2021;27.01.2022;04.03.2022;30.06.2022;118
5500030795;Разработать программы по массовому созда;Закрыт;SAPFIR;01.10.2021;-;;;-
5500030796;Консолидац ГПН-Казахстан ОК, ГПН-Азия ОК;В работе;SAP_HR;01.10.2021;21.01.2022;17.03.2022;07.07.2022;112
5500030798;АСУЗ;В согласовании.Дополн. участник согласования;OFERTA;04.10.2021;15.11.2021;23.03.2022;02.05.2022;40
5500030799;Информирование о шагах заказа;В разработке ЧТЗ;OFERTA;04.10.2021;31.12.2021;19.03.2022;15.06.2022;88
5500030800;Загрузка ФИАС в 1С КСУ НСИ ПД;Отклонен;KSU_NSI;04.10.2021;-;;;-
5500030801;«Для обеспечения корректной интеграции м;В работе;OIS_PLUS;01.10.2021;29.12.2021;29.08.2022;26.11.2022;89
5500030802;825 (ЧТЗ 11.) Основные средства и объект;Отклонен;ERP_KFSCH;01.10.2021;-;;;-
5500030803;Интеграция SAP с ИС Атлас;В разработке ЧТЗ;KSUI;01.10.2021;11.03.2022;02.05.2022;10.10.2022;161
5500030804;Расширение реплики ИС СМБ на платформе К;Согласование ЧТЗ Инициатором;SMB;01.10.2021;08.12.2021;23.05.2022;30.07.2022;68
5500030805;Расширение реплики ИС Эра-Ремонты на пла;В согласовании.Владелец шаблона;ERA_REM;01.10.2021;11.10.2021;22.02.2022;02.03.2022;8
5500030806;БРД_1С_ERP_ЧТЗ_701_Формирование затрат п;В ожидании акта от подрядчика;ERP_KFSCH;04.10.2021;11.03.2022;07.01.2022;11.03.2022;62
5500030807;Корректировка СМБ.Монитор модуля режим а;В разработке ЧТЗ;SMB;04.10.2021;31.12.2021;26.05.2022;22.08.2022;88
5500030808;Интеграция ЦП КОМПАС: Портал адаптаци;В разработке ЧТЗ;KSHD;04.10.2021;14.04.2022;05.06.2022;14.12.2022;192
5500030809;Расширение структуры транзакционных данн;В разработке ЧТЗ;KSHD;04.10.2021;28.03.2022;05.06.2022;27.11.2022;175
5500030810;Расширение структуры транзакционных данн;В разработке ЧТЗ;ERP_KFSCH;04.10.2021;28.02.2022;31.01.2022;27.06.2022;147
5500030811;Расширение структуры транзакционных данн;В разработке ЧТЗ;UPP_NS;04.10.2021;25.02.2022;07.02.2022;01.07.2022;144
5500030812;Расширение структуры транзакционных данн;В разработке ЧТЗ;UPP_AERO;04.10.2021;28.02.2022;17.03.2022;11.08.2022;147
5500030813;Расширение структуры транзакционных данн;В разработке ЧТЗ;UPP_MB;04.10.2021;28.02.2022;22.05.2022;16.10.2022;147
5500030814;Интеграция ИС ГеоБД с системой КЛАД DW (;В согласовании.Менеджер процесса;GEOBD;04.10.2021;07.10.2021;21.04.2022;22.04.2022;1
5500030815;Доработка технической роли для интеграци;В работе;NSI_ESMUR;04.10.2021;12.11.2021;08.04.2022;17.05.2022;39
5500030816;Оптимизация процесса 12.02.07 «Учет инци;Согласование ЧТЗ ДКЗ;SEVBB;04.10.2021;10.01.2022;29.04.2022;05.08.2022;98
5500030817;Автоматизация процесса работы с ошибками;Приемка Сервис Менеджером;SKIB;04.10.2021;31.12.2021;13.02.2022;08.05.2022;84
5500030819;Проблемы в транзакциях ZCLEAR и FB05/ FB;Отклонен;SAPFIR;05.10.2021;-;;;-
5500030820;Требуется настроить SSO для всех мандант;В работе;SAP_BASIS;05.10.2021;18.02.2022;27.05.2022;10.10.2022;136
5500030821;Расширение структуры транзакционных данн;В разработке ЧТЗ;KHD_BEF;05.10.2021;24.04.2022;06.04.2022;24.10.2022;201
5500030822;646 НСИ: Ответственные лица организации.;Приемка Сервис Менеджером;ERP_KFSCH;05.10.2021;29.12.2021;16.01.2022;07.04.2022;81
5500030823;Получение данных о допусках, удостоверен;Проверка Координатором;ZUP;05.10.2021;18.10.2021;15.05.2022;26.05.2022;11
5500030824;Получение данных о допусках, удостоверен;Отклонен;SAP_HR;05.10.2021;-;;;-
5500030825;Получение данных о допусках, удостоверен;В разработке ЧТЗ;KSHD;05.10.2021;17.03.2022;06.06.2022;16.11.2022;163
5500030826;Размещение обновленных проформ типовых Д;В разработке ЧТЗ;OFERTA;05.10.2021;29.12.2021;20.03.2022;13.06.2022;85
5500030827;1201 Доработка формы Ш-14.03.03-05;Закрыт;SAP_HR;05.10.2021;-;;;-
5500030828;1201 Доработка формы Ш-14.03.06-28;В работе;SAP_HR;05.10.2021;30.12.2021;21.03.2022;15.06.2022;86
5500030829;АСУЗ;Приемка Сервис Менеджером;OFERTA;05.10.2021;10.01.2022;04.03.2022;05.06.2022;93
5500030831;Перекладка покупки МТБЭ между ВБЕ ПАО;В разработке ЧТЗ;SPO;05.10.2021;14.01.2022;14.04.2022;24.07.2022;101
5500030832;Получение данных о наградах из кадровых;Отклонен;ZUP;05.10.2021;-;;;-
5500030833;Получение данных о наградах из кадровых;Отклонен;SAP_HR;05.10.2021;-;;;-
5500030834;Получение данных о наградах из кадровых;Отклонен;KSHD;05.10.2021;-;;;-
5500030835;Деактивировать в ОЗОС поля «Фонд, ПФМ, Ф;Приемка Сервис Менеджером;SAPFIR;05.10.2021;31.12.2021;05.03.2022;27.05.2022;83
5500030836;Миграция BPC на новую HANA;Закрыт;SAP_BASIS;05.10.2021;-;;;-
5500030837;Оптимизация процесса контроля несогласов;В разработке ЧТЗ;SKIB;05.10.2021;14.01.2022;02.03.2022;11.06.2022;101
5500030838;Настройка интеграции с ARIS ДРП и BI ДРП;В разработке ЧТЗ;KSU_NSI;05.10.2021;28.01.2022;13.06.2022;06.10.2022;115
5500030839;СППР 00-00000795: Переход на новую верси;В ожидании акта от подрядчика;ERP_KFSCH;05.10.2021;17.02.2022;08.01.2022;17.02.2022;39
5500030840;"СППР 00-00000829: Доработка модуля ""Конт";В ожидании акта от подрядчика;ERP_KFSCH;05.10.2021;04.03.2022;08.01.2022;04.03.2022;54
5500030841;Доработка «ЕСОН АРМ». Установка таймауто;Согласование ЧТЗ ДЗКСУ;ESON;05.10.2021;31.12.2021;06.06.2022;01.09.2022;87
5500030842;Доработка функционала ИС «ЕСОН-АРМ» АТ М;В согласовании.Менеджер процесса;ESON;06.10.2021;15.11.2021;29.05.2022;06.07.2022;38
5500030843;Доработки транзакции ZINMM772 позиции с\;В разработке ЧТЗ;OFERTA;06.10.2021;24.12.2021;21.03.2022;08.06.2022;79
5500030844;Оформление некоммерческих грузов в ИС «Е;В работе;ESON;06.10.2021;28.12.2021;26.05.2022;17.08.2022;83
5500030845;Доработка отчета «Штатное расписание по;Закрыт;ZUP;06.10.2021;-;;;-
5500030846;Организация тестового ландшафта для  про;Приемка Сервис Менеджером;ZUP;06.10.2021;29.12.2021;24.04.2022;13.07.2022;80
5500030847;Организация и проведение тестирование ре;В работе;ZUP;06.10.2021;14.02.2022;28.04.2022;06.09.2022;131
5500030848;Выгрузка метаданных из 1С АСУА Аэро, 1С;Согласование ЧТЗ ВБР;TOIR_AERO;06.10.2021;31.12.2021;27.03.2022;21.06.2022;86
5500030849;"Выгрузка метаданных из 1С УПП МБ; 1С УПП";Согласование ЧТЗ Архитектором;UPP_MB;06.10.2021;28.12.2021;24.05.2022;15.08.2022;83
5500030850;Выгрузка метаданных из 1С ТОиР МБ и смеж;Дополнительное согласование ЧТЗ;TOIR_BUNKE;06.10.2021;17.12.2021;27.03.2022;07.06.2022;72
5500030851;Проверка-заполнение БА заявок и DMS;В разработке ЧТЗ;KSHD;06.10.2021;14.04.2022;07.06.2022;14.12.2022;190
5500030852;Проверка-заполнение БА заявок и DMS;В согласовании.Владелец шаблона;NEW_SED;06.10.2021;12.10.2021;03.06.2022;07.06.2022;4
5500030853;Расширение структуры транзакционных данн;В разработке ЧТЗ;KSHD;06.10.2021;04.04.2022;07.06.2022;04.12.2022;180
5500030854;Расширение структуры транзакционных данн;В разработке ЧТЗ;ERP_KFSCH;06.10.2021;31.12.2021;02.02.2022;29.04.2022;86
5500030855;Расширение структуры транзакционных данн;В разработке ЧТЗ;UPP_NS;06.10.2021;28.02.2022;09.02.2022;04.07.2022;145
5500030856;Расширение структуры транзакционных данн;В разработке ЧТЗ;UPP_AERO;06.10.2021;28.02.2022;19.03.2022;11.08.2022;145
5500030857;Расширение структуры транзакционных данн;В разработке ЧТЗ;UPP_MB;06.10.2021;31.01.2022;24.05.2022;18.09.2022;117
5500030858;СПО Добавление элементов в измерение Acc;Согласование оценки Арх ИТ-реш;SPO;06.10.2021;23.11.2021;10.04.2022;26.05.2022;46
5500030859;Причины приостановки работ для ОЦО;В ожидании акта от подрядчика;KSUIT;06.10.2021;10.03.2022;09.02.2022;10.03.2022;28
5500030860;Оценка обслуживания;В ожидании акта от подрядчика;PORTALSELF;06.10.2021;15.03.2022;28.05.2022;15.03.2022;-
5500030861;Необходимо из OIS+ в ИС ШТР настроить ин;В разработке ЧТЗ;SHAHMATKA;06.10.2021;30.06.2022;24.07.2022;17.04.2023;267
5500030862;Разработать подсистему «Управление досту;Приемка Сервис Менеджером;SKIB;06.10.2021;31.12.2021;15.02.2022;08.05.2022;82
5500030863;Реализация блокирования использования М;Согласование ЧТЗ ДКЗ;OFERTA;06.10.2021;27.12.2021;21.03.2022;11.06.2022;82
5500030864;Добавление полномочий в роль;В ожидании акта от подрядчика;SK_FO;06.10.2021;15.03.2022;22.04.2022;15.03.2022;-
5500030865;Реализаия возможности перехода в транзак;В работе;OFERTA;06.10.2021;15.03.2022;09.03.2022;16.08.2022;160
5500030866;798Доработки ERP-ДО. Настройка интеграци;В ожидании акта от подрядчика;ERP_KFSCH;06.10.2021;09.03.2022;09.01.2022;09.03.2022;58
5500030867;Модернизация возможности поиска запасов;В работе;OFERTA;06.10.2021;15.03.2022;09.03.2022;16.08.2022;160
5500030868;Обеспечение возможность перекодировки МТ;Отклонен;OFERTA;06.10.2021;-;;;-
5500030869;Разработка интерактивной инструкции;В разработке ЧТЗ;PORTAL_BB;06.10.2021;13.02.2022;25.06.2022;02.11.2022;130
5500030870;"Настройка шаблона УЗ для БЕ 1110 ООО ""Га";Приемка Сервис Менеджером;AO_MTO;08.10.2021;31.12.2021;19.04.2022;08.07.2022;80
5500030871;Организация и проведение переноса данных;Приемка Сервис Менеджером;ZUP;06.10.2021;27.12.2021;24.04.2022;11.07.2022;78
5500030872;Настройка интеграции с Новый СЭД (Tessa);В разработке ЧТЗ;NEW_SED;06.10.2021;28.02.2022;30.05.2022;22.10.2022;145
5500030873;Экспертиза организационных и стратегичес;Отклонен;ISUP_GPN;07.10.2021;-;;;-
5500030874;Экспертиза организационных и стратегичес;Отклонен;ISUP_GPN;07.10.2021;-;;;-
